{
  "schema_version": "1.0.0",
  "reference_id": "workflow-surfaces",
  "repo": {
    "project_id": "relay",
    "repo_id": "Paintersrp/relay",
    "branch": "main"
  },
  "generated_by": {
    "name": "relay-agentrefs",
    "version": "0.1.0"
  },
  "rendering": {
    "json_primary": true,
    "markdown_from_json": true,
    "deterministic_sort": true,
    "no_timestamps": true,
    "relative_paths_only": true
  },
  "source_inputs": [
    {
      "path": "internal/app/workflow/types.go",
      "sha256": "c0ceec927bc733f49d11ae73ed706a3652756d2bc059bfccd1781cf8de654ae5",
      "role": "workflow types"
    },
    {
      "path": "internal/store/workflow/types.go",
      "sha256": "2b462e8fd11bb276f742b170ed188f4708c6e5ab888669aacec6c3e45c3d795c",
      "role": "workflow store types"
    }
  ],
  "fact_labels": [
    "proven",
    "derived",
    "convention",
    "unresolved",
    "conflict"
  ],
  "facts": [
    {
      "id": "workflow-canonical-model",
      "label": "proven",
      "statement": "Relay uses a canonical workflow model with Projects, Plans, Runs, and Audit. Projects organize Plans; Plans contain Passes; Runs are Managed (by Plan/pass) or Standalone. Run stages are Specification, Execute, and Audit.",
      "evidence": [
        {
          "kind": "source",
          "value": "internal/app/workflow/types.go"
        }
      ]
    },
    {
      "id": "workflow-persistence",
      "label": "proven",
      "statement": "Workflow data is persisted in SQLite through internal/store/workflow. Canonical bytes are stored immutably with SHA-256 hashes.",
      "evidence": [
        {
          "kind": "source",
          "value": "internal/store/workflow/types.go"
        }
      ]
    }
  ],
  "references": []
}
