{
  "schema_version": "1.0.0",
  "reference_id": "project-agent-references-index",
  "repo": {
    "project_id": "relay",
    "repo_id": "Paintersrp/relay",
    "branch": "main"
  },
  "generated_by": {
    "name": "relay-agentrefs",
    "version": "0.1.0"
  },
  "rendering": {
    "json_primary": true,
    "markdown_from_json": true,
    "deterministic_sort": true,
    "no_timestamps": true,
    "relative_paths_only": true
  },
  "source_inputs": [
    {
      "path": "AGENTS.md",
      "sha256": "e9b318d2dfb8cedc29db3c8beffb3ca500a7e0945acd5683373082e92a1ba7de",
      "role": "agent instructions"
    },
    {
      "path": "Makefile",
      "sha256": "15aefa83783ac4cfe6530c6213317a45bfbf4be0d96cc43f2eb2b5c921e89d96",
      "role": "build configuration"
    },
    {
      "path": "docs/agent-reference.md",
      "sha256": "781ce7a717be265d38611dc1cf4fdbcb0686fde93d64de015227d01a75075691",
      "role": "agent reference"
    },
    {
      "path": "docs/backend-code-surface-map.md",
      "sha256": "f3eb4c9e1fdfc1d4ea3f38dc7f4cac8dc5611b78dc9ce6bcb73542f44afc1382",
      "role": "backend surface map"
    },
    {
      "path": "schema/project_agent_reference.schema.json",
      "sha256": "d48d8471f6d8d99a2ae978b2efd94dab52ca2b307b34f00b4fa71cc95d5fedfd",
      "role": "schema contract"
    }
  ],
  "fact_labels": [
    "proven",
    "derived",
    "convention",
    "unresolved",
    "conflict"
  ],
  "facts": [
    {
      "id": "foundation-scope",
      "label": "proven",
      "statement": "PASS-001 creates only foundation/index output. No domain scanners are implemented in this pass.",
      "evidence": [
        {
          "kind": "schema",
          "value": "schema/project_agent_reference.schema.json"
        },
        {
          "kind": "source",
          "value": "cmd/agentrefs/main.go"
        }
      ]
    }
  ],
  "references": [
    {
      "id": "backend-surface",
      "kind": "generated_reference",
      "path": "docs/generated/agent-references/backend-surface.json",
      "description": "Generated backend package, service, handler, symbol, import-edge, and adjacent-test surface reference."
    },
    {
      "id": "frontend-backend-contract",
      "kind": "generated_reference",
      "path": "docs/generated/agent-references/frontend-backend-contract.json",
      "description": "Generated frontend/backend contract reference: frontend API clients, query keys, TypeScript contracts, backend HTTP route matches, and backend Go DTO alignment."
    },
    {
      "id": "http-api-surface",
      "kind": "generated_reference",
      "path": "docs/generated/agent-references/http-api-surface.json",
      "description": "Generated HTTP/API route surface reference: method, path, handler, source file, and route group from route source files."
    },
    {
      "id": "mcp-registry",
      "kind": "generated_reference",
      "path": "docs/generated/agent-references/mcp-surface.json",
      "description": "Generated MCP action registry reference: tool definitions, dispatch handlers, profile gating, mutating vs retrieval-only behavior, and forbidden side effects."
    },
    {
      "id": "storage-surface",
      "kind": "generated_reference",
      "path": "docs/generated/agent-references/storage-surface.json",
      "description": "Generated storage, migration, SQL query, sqlc-boundary, and store-wrapper surface reference."
    },
    {
      "id": "workflow-surfaces",
      "kind": "generated_reference",
      "path": "docs/generated/agent-references/workflow-surfaces.json",
      "description": "Generated Plan v2 workflow, intent packet, drift review, refactor backlog, and work-packet lifecycle surface reference."
    }
  ]
}
