{
  "schema_version": "1.0.0",
  "reference_id": "project-mcp-registry",
  "repo": {
    "project_id": "relay",
    "repo_id": "Paintersrp/relay",
    "branch": "main"
  },
  "generated_by": {
    "name": "relay-agentrefs",
    "version": "0.1.0"
  },
  "rendering": {
    "json_primary": true,
    "markdown_from_json": true,
    "deterministic_sort": true,
    "no_timestamps": true,
    "relative_paths_only": true
  },
  "source_inputs": [
    {
      "path": "internal/mcp/audit_tools.go",
      "sha256": "149372f4e719bb04aa591c32205b894e1287ee9a59ddd4d4105b5edccaf2c281",
      "role": "mcp_tool_source"
    },
    {
      "path": "internal/mcp/server.go",
      "sha256": "ca8c46471048d1e2800262b653664993e8dcfff08503c1ec14d70131f4aed733",
      "role": "mcp_tool_source"
    }
  ],
  "fact_labels": [
    "proven",
    "derived",
    "convention",
    "unresolved",
    "conflict"
  ],
  "facts": [
    {
      "id": "mcp-canonical-tools",
      "label": "proven",
      "statement": "Relay exposes canonical MCP tools: planner (validate_artifact, list_projects, submit_plan, get_plan, create_run), auditor (validate_artifact, create_run, get_audit_packet, record_audit_decision), and local_operator (union).",
      "evidence": [
        {
          "kind": "source",
          "value": "internal/mcp/server.go"
        }
      ]
    },
    {
      "id": "mcp-profile-based-registration",
      "label": "proven",
      "statement": "Tool registration is controlled by RELAY_MCP_PROFILE environment variable selecting planner, auditor, or local_operator profile.",
      "evidence": [
        {
          "kind": "source",
          "value": "internal/mcp/server.go"
        }
      ]
    }
  ],
  "references": []
}
